{
  "stage": "S1",
  "executionStatus": "NOT_STARTED",
  "localGate": "NOT_EVALUATED",
  "testedSourceCommit": null,
  "evidenceCommit": null,
  "providerBindings": [
    {
      "owner": "AirOffer",
      "profile": "LIVE-CANDIDATE-SANDBOX",
      "mode": "LiveCandidateSandbox",
      "certification": "NOT_EVALUATED",
      "evidenceRef": null,
      "blockers": [
        "BD-001"
      ]
    }
  ],
  "scenarioResults": [
    {
      "scenarioId": "SC-S1-001",
      "result": "NOT_RUN",
      "testName": "To be assigned by implementation agent",
      "evidenceRef": null
    }
  ],
  "reproductionCommand": "<repository/user-approved reproduction command>",
  "blockers": [
    "Runtime evidence is not supplied by the Design Pack"
  ],
  "releaseCertified": false
}

